{
  "story_id": "3dae7ad2-0bbc-5a31-8f23-4b80af46133e",
  "input_code": "SGI-ALEK-HYDRANGEA-01",
  "output_code": "SGO-ALEK-HYDRANGEA-01",
  "gardener": {
    "name": "Alek",
    "gardener_id": "GDR-ALEK"
  },
  "flower": {
    "id": "hydrangea",
    "name": "Hydrangea",
    "immutable": true
  },
  "state": {
    "level": 0,
    "status": "generated"
  },
  "input": {
    "n": "Alek",
    "f": "Hydrangea",
    "i": "karna sempat datang ke toko bunga dan ketemu bunga itu, dan saat di lihat tampilannya indah dan natural. dan saat di sentuh lembut. dan juga relate, dengan hidupnya sekarang."
  },
  "output": {
    "inspiration": "The Hydrangea.\n\nAlek pertama kali bertemu Hydrangea ketika ia datang ke sebuah toko bunga.\n\nDi antara bunga-bunga yang ada, pandangannya berhenti pada Hydrangea. Ada sesuatu dari tampilannya yang terasa indah dan natural—tidak berlebihan, tetapi tetap memiliki daya tarik yang membuatnya ingin melihat lebih dekat.\n\nBahkan ketika disentuh, kelembutan bunga itu memberikan kesan tersendiri.\n\nNamun mungkin yang membuat Hydrangea terasa lebih berarti bukan hanya karena keindahannya. Ada sesuatu dalam bunga itu yang terasa relate dengan kehidupan Alek saat ini.\n\nBelum tentu semua hal harus langsung memiliki penjelasan. Terkadang, kita terlebih dahulu merasa dekat dengan sesuatu sebelum benar-benar memahami mengapa.\n\nMungkin pertemuan sederhana di sebuah toko bunga itulah yang membuat Hydrangea perlahan menjadi lebih dari sekadar bunga yang indah bagi Alek."
  },
  "maturity": {
    "mr": "absent",
    "i": "raw"
  }
}