{
  "story_id": "c3fec366-bf53-565f-9b19-c3d1a764ac03",
  "input_code": "SGI-BEEYA-COMMONSUNFLOWER",
  "output_code": "SGO-BEEYA-COMMONSUNFLOWER",
  "gardener": {
    "name": "Beeya",
    "gardener_id": "GDR-BEEYA"
  },
  "flower": {
    "id": "commonsunflower",
    "name": "Common Sunflower",
    "immutable": true
  },
  "state": {
    "level": 0,
    "status": "generated"
  },
  "input": {
    "n": "Beeya",
    "f": "Common Sunflower",
    "i": "kuning memberikan kesan kebahagiaan. bunga matahari juga di simbolkan sebagai kesetiaan, karna selalu menghadap kemana arah matahari. dan juga sering lihat di film2 dan terfokus pada karakter wanita yang memakai gaun/pakaian berwarna kuning, seakan warna kuning ada sesuatu yang menarik. juga dalam percintaan, warna kuning itu bermakna kehangatan, keceriaan, optimis, keterbukaan emosional."
  },
  "output": {
    "inspiration": "aku memilih bunga ini karna warna kuningnya memberikan kesan kebahagiaan, hangat, dan ceria.\n\nAda sesuatu dari warna kuning yang selalu terasa menarik bagi Beeya. Ia sering menemukannya dalam film, terutama ketika warna itu hadir pada pakaian atau gaun seorang perempuan dan tanpa sadar membuat perhatiannya berhenti lebih lama. Seolah-olah kuning memiliki daya tarik tersendiri—sederhana, tetapi mampu membuat sesuatu terasa lebih hidup.\n\nBunga matahari kemudian membawa kesan itu ke dalam bentuk yang lebih utuh. Ia sering dikaitkan dengan kesetiaan karena dikenal menghadap ke arah datangnya cahaya matahari. Di sisi lain, warna kuning juga terasa dekat dengan kehangatan, keceriaan, optimisme, dan keterbukaan emosional, terutama ketika berbicara tentang hubungan dan perasaan.\n\nMungkin itulah yang membuat Common Sunflower terasa dekat bagi Beeya. Bukan hanya karena bunganya terlihat cerah, tetapi karena warna dan simbol yang dibawanya seakan memiliki sesuatu yang ingin disampaikan: tentang rasa hangat, ketertarikan, kesetiaan, dan keberanian untuk tetap terbuka terhadap perasaan."
  },
  "maturity": {
    "mr": "absent",
    "i": "raw"
  }
}
