{
  "story_id": "1db47954-d35a-52ed-a16e-053823169a26",
  "input_code": "SGI-DEVANY-CASABLANCALILY-01",
  "output_code": "SGO-DEVANY-CASABLANCALILY-01",
  "gardener": {
    "name": "Devany",
    "gardener_id": "GDR-DEVANY"
  },
  "flower": {
    "id": "casablancalily",
    "name": "Casablanca Lily",
    "immutable": true
  },
  "state": {
    "level": 0,
    "status": "generated"
  },
  "input": {
    "n": "Devany",
    "f": "Casablanca Lily"
  },
  "output": {
    "inspiration": "The Casablanca Lily.\n\nUntuk saat ini, Casablanca Lily menjadi sebuah pilihan yang ceritanya masih terbuka.\n\nBelum diketahui apakah Devany memilihnya karena bentuknya, warnanya, aromanya, sebuah kenangan, seseorang, atau mungkin karena sesuatu yang bahkan sulit dijelaskan dengan kata-kata.\n\nDan tidak apa-apa.\n\nSebuah bunga tidak harus langsung memiliki cerita ketika pertama kali dipilih. Terkadang, pilihan datang lebih dahulu—lalu alasannya perlahan ditemukan setelahnya.\n\nMungkin Casablanca Lily adalah jawabannya. Mungkin juga ia adalah pertanyaan yang baru saja dimulai."
  },
  "maturity": {
    "mr": "absent",
    "i": "absent"
  }
}